{"$id":"https://api.univents.com.br/schemas/profile.schema.json","type":"object","title":"Profile","$schema":"https://json-schema.org/draft/2020-12/schema","required":["legalName","preferredName","createdAt","updatedAt"],"properties":{"role":{"type":"string","maxLength":100,"description":"What the user does for work / job title (e.g. 'Backend Engineer', 'Product Designer', 'Student'). Distinct from platform RBAC roles."},"pfpUrl":{"type":["string","null"],"format":"uri","description":"Profile picture URL."},"aboutMe":{"type":"string","maxLength":2000,"description":"Freeform bio."},"socials":{"type":"object","properties":{"x":{"type":["string","null"],"maxLength":200},"github":{"type":["string","null"],"maxLength":200},"twitch":{"type":["string","null"],"maxLength":200},"bluesky":{"type":["string","null"],"maxLength":200},"discord":{"type":["string","null"],"maxLength":200},"youtube":{"type":["string","null"],"maxLength":200},"linkedin":{"type":["string","null"],"maxLength":200},"instagram":{"type":["string","null"],"maxLength":200}},"description":"Handles/URLs only, no OAuth tokens here.","additionalProperties":false},"tagline":{"type":"string","maxLength":140,"description":"Short one-liner shown under the name (optional, separate from full bio)."},"website":{"type":["string","null"],"format":"uri"},"location":{"type":"object","properties":{"city":{"type":"string","maxLength":100},"region":{"type":"string","maxLength":100},"country":{"type":"string","maxLength":100},"countryCode":{"type":"string","maxLength":2,"minLength":2,"description":"ISO 3166-1 alpha-2."}},"additionalProperties":false},"pronouns":{"type":"string","maxLength":30},"timezone":{"type":"string","description":"IANA timezone, e.g. 'America/Sao_Paulo'."},"bannerUrl":{"type":["string","null"],"format":"uri","description":"Profile banner/cover image URL."},"createdAt":{"type":"string","format":"date-time"},"languages":{"type":"array","items":{"type":"string","description":"BCP-47 language tag, e.g. 'pt-BR', 'en'."},"maxItems":10},"legalName":{"type":"string","maxLength":200,"minLength":1,"description":"Full legal name. Used for certificates, invoices, and compliance. Not shown publicly unless hideLegalName is false."},"updatedAt":{"type":"string","format":"date-time"},"visibility":{"type":"object","properties":{"hideSocials":{"type":"boolean","default":false},"hideLocation":{"type":"boolean","default":false},"hideLegalName":{"type":"boolean","default":true},"hideContactEmail":{"type":"boolean","default":true},"hideOrganization":{"type":"boolean","default":false}},"description":"Per-field visibility flags. true = hidden from other users.","additionalProperties":false},"contactEmail":{"type":["string","null"],"format":"email","description":"Public contact email, optional and distinct from account login email."},"organization":{"type":"string","maxLength":150,"description":"Company, school, or org the user represents."},"preferredName":{"type":"string","maxLength":100,"minLength":1,"description":"Display name shown across the platform (profile, badges, event rosters)."},"profileCompleteness":{"type":"integer","maximum":100,"minimum":0,"description":"Computed, not user-editable. Percentage of profile fields filled."}},"description":"User-facing profile for a Univents member.","additionalProperties":false}
